{
  "schema_version": "1",
  "generator": {
    "engine": "matugen",
    "engine_version": "4.2.0",
    "schema_version": "1"
  },
  "source": {
    "kind": "image",
    "path": "/wallpapers/golden-theme.png",
    "hash": "0123456789abcdef0123456789abcdef0123456789abcdef0123456789abcdef"
  },
  "scheme": "scheme-tonal-spot",
  "contrast": 0.0,
  "modes": {
    "dark": {
      "roles": {
        "background": "#000000",
        "error": "#26201a",
        "error_container": "#4d4034",
        "inverse_on_surface": "#806a57",
        "inverse_primary": "#cdaa8a",
        "inverse_surface": "#fbd0aa",
        "on_background": "#000000",
        "on_error": "#26201a",
        "on_error_container": "#4d4034",
        "on_primary": "#806a57",
        "on_primary_container": "#cdaa8a",
        "on_primary_fixed": "#fbd0aa",
        "on_primary_fixed_variant": "#000000",
        "on_secondary": "#26201a",
        "on_secondary_container": "#4d4034",
        "on_secondary_fixed": "#806a57",
        "on_secondary_fixed_variant": "#cdaa8a",
        "on_surface": "#fbd0aa",
        "on_surface_variant": "#000000",
        "on_tertiary": "#26201a",
        "on_tertiary_container": "#4d4034",
        "on_tertiary_fixed": "#806a57",
        "on_tertiary_fixed_variant": "#cdaa8a",
        "outline": "#fbd0aa",
        "outline_variant": "#000000",
        "primary": "#26201a",
        "primary_container": "#4d4034",
        "primary_fixed": "#806a57",
        "primary_fixed_dim": "#cdaa8a",
        "scrim": "#fbd0aa",
        "secondary": "#000000",
        "secondary_container": "#26201a",
        "secondary_fixed": "#4d4034",
        "secondary_fixed_dim": "#806a57",
        "shadow": "#cdaa8a",
        "source_color": "#fbd0aa",
        "surface": "#000000",
        "surface_bright": "#26201a",
        "surface_container": "#4d4034",
        "surface_container_high": "#806a57",
        "surface_container_highest": "#cdaa8a",
        "surface_container_low": "#fbd0aa",
        "surface_container_lowest": "#000000",
        "surface_dim": "#26201a",
        "surface_tint": "#4d4034",
        "surface_variant": "#806a57",
        "tertiary": "#cdaa8a",
        "tertiary_container": "#fbd0aa",
        "tertiary_fixed": "#000000",
        "tertiary_fixed_dim": "#26201a"
      },
      "palettes": {
        "primary": {
          "0": "#000000",
          "5": "#0c0a08",
          "10": "#191511",
          "15": "#261f19",
          "20": "#332a22",
          "25": "#3f342a",
          "30": "#4c3f33",
          "35": "#59493b",
          "40": "#665444",
          "50": "#7f6955",
          "60": "#997e66",
          "70": "#b29377",
          "80": "#cca888",
          "90": "#e5bd99",
          "95": "#f2c7a1",
          "98": "#f9cda6",
          "99": "#fccfa8",
          "100": "#ffd2aa"
        },
        "secondary": {
          "0": "#000000",
          "5": "#0d0b09",
          "10": "#191511",
          "15": "#26201a",
          "20": "#332a22",
          "25": "#40352b",
          "30": "#4c3f33",
          "35": "#594a3c",
          "40": "#665444",
          "50": "#7f6955",
          "60": "#997e66",
          "70": "#b29377",
          "80": "#cca888",
          "90": "#e5bd99",
          "95": "#f2c8a2",
          "98": "#facea7",
          "99": "#fcd0a9",
          "100": "#ffd2aa"
        },
        "tertiary": {
          "0": "#000101",
          "5": "#0d0b09",
          "10": "#1a1612",
          "15": "#26201a",
          "20": "#332b23",
          "25": "#40352b",
          "30": "#4d4034",
          "35": "#594a3c",
          "40": "#665545",
          "50": "#806a56",
          "60": "#997f67",
          "70": "#b39478",
          "80": "#cca989",
          "90": "#e6be9a",
          "95": "#f2c8a2",
          "98": "#facea8",
          "99": "#fdd0a9",
          "100": "#ffd3ab"
        },
        "neutral": {
          "0": "#010102",
          "5": "#0d0c0a",
          "10": "#1a1613",
          "15": "#27211b",
          "20": "#342b24",
          "25": "#40362c",
          "30": "#4d4035",
          "35": "#5a4b3d",
          "40": "#675546",
          "50": "#806a57",
          "60": "#9a7f68",
          "70": "#b39479",
          "80": "#cda98a",
          "90": "#e6be9b",
          "95": "#f3c9a3",
          "98": "#fbcfa8",
          "99": "#fdd1aa",
          "100": "#ffd3ac"
        },
        "neutral_variant": {
          "0": "#010202",
          "5": "#0e0c0b",
          "10": "#1a1713",
          "15": "#27211c",
          "20": "#342c24",
          "25": "#41362d",
          "30": "#4d4135",
          "35": "#5a4b3e",
          "40": "#675646",
          "50": "#806b57",
          "60": "#9a8068",
          "70": "#b39579",
          "80": "#cdaa8a",
          "90": "#e6bf9b",
          "95": "#f3c9a4",
          "98": "#fbcfa9",
          "99": "#fdd2ab",
          "100": "#ffd4ac"
        },
        "error": {
          "0": "#010203",
          "5": "#0e0d0c",
          "10": "#1b1714",
          "15": "#28221d",
          "20": "#342c25",
          "25": "#41372e",
          "30": "#4e4136",
          "35": "#5b4c3f",
          "40": "#675647",
          "50": "#816b58",
          "60": "#9a8069",
          "70": "#b4957a",
          "80": "#cdaa8b",
          "90": "#e7bf9c",
          "95": "#f4caa5",
          "98": "#fbd0aa",
          "99": "#fed2ab",
          "100": "#ffd4ad"
        }
      }
    },
    "light": {
      "roles": {
        "background": "#0d0b09",
        "error": "#332b23",
        "error_container": "#5a4b3d",
        "inverse_on_surface": "#9a8068",
        "inverse_primary": "#e7bf9c",
        "inverse_surface": "#fed3ac",
        "on_background": "#0d0b09",
        "on_error": "#332b23",
        "on_error_container": "#5a4b3d",
        "on_primary": "#9a8068",
        "on_primary_container": "#e7bf9c",
        "on_primary_fixed": "#fed3ac",
        "on_primary_fixed_variant": "#0d0b09",
        "on_secondary": "#332b23",
        "on_secondary_container": "#5a4b3d",
        "on_secondary_fixed": "#9a8068",
        "on_secondary_fixed_variant": "#e7bf9c",
        "on_surface": "#fed3ac",
        "on_surface_variant": "#0d0b09",
        "on_tertiary": "#332b23",
        "on_tertiary_container": "#5a4b3d",
        "on_tertiary_fixed": "#9a8068",
        "on_tertiary_fixed_variant": "#e7bf9c",
        "outline": "#fed3ac",
        "outline_variant": "#0d0b09",
        "primary": "#332b23",
        "primary_container": "#5a4b3d",
        "primary_fixed": "#9a8068",
        "primary_fixed_dim": "#e7bf9c",
        "scrim": "#fed3ac",
        "secondary": "#0d0b09",
        "secondary_container": "#332b23",
        "secondary_fixed": "#5a4b3d",
        "secondary_fixed_dim": "#9a8068",
        "shadow": "#e7bf9c",
        "source_color": "#fed3ac",
        "surface": "#0d0b09",
        "surface_bright": "#332b23",
        "surface_container": "#5a4b3d",
        "surface_container_high": "#9a8068",
        "surface_container_highest": "#e7bf9c",
        "surface_container_low": "#fed3ac",
        "surface_container_lowest": "#0d0b09",
        "surface_dim": "#332b23",
        "surface_tint": "#5a4b3d",
        "surface_variant": "#9a8068",
        "tertiary": "#e7bf9c",
        "tertiary_container": "#fed3ac",
        "tertiary_fixed": "#0d0b09",
        "tertiary_fixed_dim": "#332b23"
      },
      "palettes": {
        "primary": {
          "0": "#000000",
          "5": "#0d0b09",
          "10": "#191511",
          "15": "#26201a",
          "20": "#332a22",
          "25": "#40352b",
          "30": "#4c3f33",
          "35": "#594a3c",
          "40": "#665444",
          "50": "#7f6955",
          "60": "#997e66",
          "70": "#b29377",
          "80": "#cca888",
          "90": "#e5bd99",
          "95": "#f2c8a2",
          "98": "#facea7",
          "99": "#fcd0a9",
          "100": "#ffd2aa"
        },
        "secondary": {
          "0": "#000101",
          "5": "#0d0b09",
          "10": "#1a1612",
          "15": "#26201a",
          "20": "#332b23",
          "25": "#40352b",
          "30": "#4d4034",
          "35": "#594a3c",
          "40": "#665545",
          "50": "#806a56",
          "60": "#997f67",
          "70": "#b39478",
          "80": "#cca989",
          "90": "#e6be9a",
          "95": "#f2c8a2",
          "98": "#facea8",
          "99": "#fdd0a9",
          "100": "#ffd3ab"
        },
        "tertiary": {
          "0": "#010102",
          "5": "#0d0c0a",
          "10": "#1a1613",
          "15": "#27211b",
          "20": "#342b24",
          "25": "#40362c",
          "30": "#4d4035",
          "35": "#5a4b3d",
          "40": "#675546",
          "50": "#806a57",
          "60": "#9a7f68",
          "70": "#b39479",
          "80": "#cda98a",
          "90": "#e6be9b",
          "95": "#f3c9a3",
          "98": "#fbcfa8",
          "99": "#fdd1aa",
          "100": "#ffd3ac"
        },
        "neutral": {
          "0": "#010202",
          "5": "#0e0c0b",
          "10": "#1a1713",
          "15": "#27211c",
          "20": "#342c24",
          "25": "#41362d",
          "30": "#4d4135",
          "35": "#5a4b3e",
          "40": "#675646",
          "50": "#806b57",
          "60": "#9a8068",
          "70": "#b39579",
          "80": "#cdaa8a",
          "90": "#e6bf9b",
          "95": "#f3c9a4",
          "98": "#fbcfa9",
          "99": "#fdd2ab",
          "100": "#ffd4ac"
        },
        "neutral_variant": {
          "0": "#010203",
          "5": "#0e0d0c",
          "10": "#1b1714",
          "15": "#28221d",
          "20": "#342c25",
          "25": "#41372e",
          "30": "#4e4136",
          "35": "#5b4c3f",
          "40": "#675647",
          "50": "#816b58",
          "60": "#9a8069",
          "70": "#b4957a",
          "80": "#cdaa8b",
          "90": "#e7bf9c",
          "95": "#f4caa5",
          "98": "#fbd0aa",
          "99": "#fed2ab",
          "100": "#ffd4ad"
        },